{"acceptanceCriteria":[{"evidence":"tests/opencode-plugin/csm-continue-core.test.mjs green.","id":"AC1","statement":"A pure continuation decision core returns continue with an exact resume command when the guard reports work and status is not blocked or paused, and stop or pause otherwise."},{"evidence":"tests/opencode-plugin/csm-continue-plugin.test.mjs green plus the recorded spike result.","id":"AC2","statement":"The opencode plugin wrapper injects at most a bounded, no-progress-limited number of continuation prompts on session.idle, honors dedicated kill switches, and records the re-entry spike outcome."},{"evidence":"tests/opencode-plugin/csm-continue-install.test.mjs, csm-continue-cli.test.mjs, and completion-supervisor-docs.test.mjs green.","id":"AC3","statement":"The install script is idempotent, dry-run safe, installs the full dependency set, and never auto-installs; a runbook documents opt-in, kill switches, budget, the mandatory pilot with a NO-GO threshold, and rollback."},{"evidence":"tests/completion-evidence.test.mjs and completion-evidence-gate.test.mjs green.","id":"AC4","statement":"A fail-closed, plan-record-derivable completion-evidence gate rejects a bulk close-out (completed tasks with an unadvanced cursor, no per-task receipts, or a null completionReview) and is wired into the lineage gate."},{"evidence":"tests/plan-completion-contract.test.mjs, plan-completion-contract-skill.test.mjs, and csm-build-completion-contract.test.mjs green.","id":"AC5","statement":"csm-plan/2 additively declares completionContract, continuationPolicy, and task executionReceipt; the csm-plan checklist requires them; csm-build consumes them into a mandatory close-out sequence; /1 records still validate."},{"evidence":"tests/new-tests-wired.test.mjs green; make regen-check and node scripts/check-suite.mjs exit 0; verify-completion verdict complete.","id":"AC6","statement":"New tests are wired into the Makefile/CI, artifacts are indexed, the change regenerates cleanly, the conformance gate passes, and a two-or-more-reviewer adversarial completeness verdict is recorded at a content digest."}],"applicability":{"bypass":{"rationale":null,"requested":false},"closure":{"closedAt":"2026-09-28T01:22:54.227Z","format":"csm-applicability-closure/1","reason":"No DDD artifacts were referenced by this plan; the warranted signals are satisfied by live tests, regen-check parity, and the two-reviewer completion verdict.","spikeCandidates":[{"candidate":"Does event.type === 'session.idle' fire at turn completion in the running opencode binary, and does client.session.prompt re-enter the same session without recursive session.idle deadlock or an unawaited-hook race? Prove it with a minimal local plugin harness before relying on it.","taskId":"T002"},{"candidate":"On one real plan, does installing the supervisor reduce stops-per-run from greater than one to zero without a runaway loop? Define the measurement (stops counted per run) and the NO-GO threshold before the pilot.","taskId":"T004"}]},"dddArtifacts":[],"decision":"warranted","evidence":[{"locator":"docs/enforcement-model.md:1-54","observation":"Completion enforcement is in-loop only; the host seam is the documented missing continuation surface.","source":"repository"},{"locator":"csm-plan/schemas/csm-plan.schema.json:1-70","observation":"The plan schema sets additionalProperties:false, so new plan fields require the additive /2 revision.","source":"repository"},{"locator":"AC1-AC6","observation":"A host plugin injecting prompts plus a new gate is a boundary and authority change.","source":"plan"}],"format":"csm-applicability/1","matchedSignals":["architecture_or_refactor","public_contract","security_or_authority"],"mode":"risk-first","obligations":[{"id":"boundary","status":"satisfied"},{"id":"ownership","status":"satisfied"},{"id":"contract","status":"satisfied"},{"id":"parity","status":"satisfied"},{"id":"observable_behavior","status":"satisfied"},{"id":"seam","status":"satisfied"},{"id":"unresolved_risks","status":"satisfied"}],"taskApplicability":{"lightweight":[],"warranted":["T001","T002","T003","T004","T005","T006","T007","T008","T009","T010","T011","T012","T013","T014"]},"unresolvedRisks":["The plugin continuation surface is documented but not yet demonstrated end-to-end; T002's spike and T004's pilot measure it, and a failed pilot is a NO-GO.","A host plugin applies to the operator's machine, not this repository; the plan ships the source and a dry-run-validated install, never an automatic install."]},"artifactId":"art-completion-supervisor-contract-20260928","assumptionsAndDecisions":[{"evidence":"TRIAGE plus the finding input; Jev deep-research-dispatch advised external-need at confidence 0.44 (advisory, low).","id":"A1","statement":"The research finding contains one DEEP finding, so no new deep-research dispatch is needed.","status":"recorded","type":"technical"},{"evidence":"docs/typed-decisions.md never-Jev boundary section 6.","id":"A2","statement":"Risk tiers and critique severities in this plan are deterministic; Jev task-risk and critique-severity scores are advisory annotations only and never touch acceptance, status, or the guard.","status":"accepted","type":"process"},{"evidence":"Host changes are user-owned; the finding records the plugin surface as unverified (U1).","id":"A3","statement":"The plugin is shipped as repository source with an opt-in install rather than auto-installed; activation is conditional on the pilot passing.","status":"accepted","type":"product"},{"evidence":"docs/enforcement-model.md section 3; csm-plan/lib/plan.mjs dual-revision reader.","id":"A4","statement":"New plan fields go into the additive csm-plan/2 revision; /1 stays frozen.","status":"accepted","type":"technical"},{"evidence":"control.commits disabled; csm-plan and csm-build activation boundaries.","id":"A5","statement":"Commits remain disabled; no task commits or pushes without a later explicit authorization.","status":"accepted","type":"process"}],"completionContract":{"closeOutSequence":["independent adversarial completeness verdict (two or more distinct reviewers)","commit owned paths only, when a later invocation explicitly authorizes it","push and drive CI green","close via closePlan with a journaled evaluator receipt"],"definitionOfDone":"Every task acceptance signal passes at a recorded content digest; make regen-check and check-suite are green; a two-or-more-reviewer independent completeness verdict is complete; CI is green on the pushed commit."},"completionReview":{"completedAt":"2026-09-28T01:22:54.227Z","gates":{"acceptanceSignals":"14/14 pass","checkSuite":"OK 1169 checks","regenCheck":"OK","reviewers":"2 independent complete"},"reviewers":["reviewer-A-independent","reviewer-B-independent"],"summary":"All 14 tasks complete; two independent reviewers returned complete; make regen-check and node scripts/check-suite.mjs green."},"continuationPolicy":{"checkpointCadence":"after every dispatch batch and at each state transition","expectedCycles":5,"guardCommand":"node csm-build/lib/loop-guard.mjs --record .agents/csm-build-state/2026-09-28-completion-supervisor-contract-build.json --plan .agents/plans/2026-09-28-completion-supervisor-contract-csm.json","sessionUnit":"one csm-build cycle (SELECT through CHECKPOINT) or a bounded dispatch batch"},"control":{"activeTasks":[],"blockers":[],"commits":"disabled","currentState":"COMPLETE","cycle":3,"lastCheckpoint":"2026-09-28: T011+T012 complete; check-suite OK 1169 checks","lastModelRun":"deepseek-flash / csm-build-completion-supervisor-contract (Jev advisory)","nextTransition":"none (terminal)","resume":{"instruction":"re-read control, latest journal, recovery notes, requirements, and working-tree diff"},"status":"complete"},"critiqueResolution":[{"findingId":"CR-01","jevAdvisory":{"answer":0.12,"note":"low advisory score; deterministic severity retained","point":"critique-severity","source":"openrouter/typesafe/jev-1.13"},"resolution":"T007 no longer invents a status value: it keeps the existing enum, exposes a resumable field, and owns the csm-build-handoff consumer.","resolutionBy":"primary (remediation applied to the plan artifact)"},{"findingId":"CR-02","jevAdvisory":{"answer":0.15,"note":"low advisory score; deterministic severity retained","point":"critique-severity","source":"openrouter/typesafe/jev-1.13"},"resolution":"T005 is restricted to single-plan-record clauses and documents that build-state checks belong to a build/orchestrate gate; T006 no longer edits check-suite.mjs and T008 adds the executionReceipt field the predicate reads.","resolutionBy":"primary (remediation applied to the plan artifact)"},{"findingId":"CR-03","jevAdvisory":{"answer":0.17,"note":"low advisory score; deterministic severity retained","point":"critique-severity","source":"openrouter/typesafe/jev-1.13"},"resolution":"T002 and T004 now carry concrete spike questions (session.idle firing and re-entry safety; pilot stops-per-run with a NO-GO threshold), and the pilot is the recorded residual.","resolutionBy":"primary (remediation applied to the plan artifact)"},{"findingId":"CR-04","jevAdvisory":{"answer":0.16,"note":"low advisory score; deterministic severity retained","point":"critique-severity","source":"openrouter/typesafe/jev-1.13"},"resolution":"Added T011 to wire every new test into the Makefile/CI with a runnable test, so check-suite cannot pass vacuously on untracked files.","resolutionBy":"primary (remediation applied to the plan artifact)"},{"findingId":"CR-05","jevAdvisory":{"answer":0.19,"note":"low advisory score; deterministic severity retained","point":"critique-severity","source":"openrouter/typesafe/jev-1.13"},"resolution":"T012 requires two or more distinct reviewers and replaces the pinned tree with a content digest.","resolutionBy":"primary (remediation applied to the plan artifact)"},{"findingId":"CR-06","jevAdvisory":{"answer":0.18,"note":"low advisory score; deterministic severity retained","point":"critiqu